report_month,venture,model,age_at_report,status,revenue_note,cost_note,verdict
2026-07,V1 services desk,marketplace freelancing on in-house automation systems,3 weeks selling,active,"$2700+ collected plus funded escrow, 5 active clients","~$300 marketplace bidding fees, <$15 tokens per ~$120 research job (estimate)",fastest path to first revenue in portfolio
2026-07,V2 content network,ad-monetized AI content network,months,active,"80000+ subscribers, six-figure annual run rate","automated production pipeline, human review gates",compounds but platform-taxed and hit-driven
2026-07,V3 trading research,algorithmic futures research,months,active pre-revenue,"none booked; backtest Sharpe 1.4-1.7 published as research artifacts","cloud backtesting and research compute",research program not income until live records exist
2026-07,sports documentary channel,long-form AI video,killed 2026-07,killed,"$0 net","production sunk cost",killed for structural copyright exposure
2026-07,faith-content brand,short-form AI video,killed 2026-07,killed,"immaterial","automated production",killed because niche monetization per view was underwater
